{
  "meta": {
    "branch": "live",
    "patch": "12.1",
    "fetched_at": "2026-10-08T09:08:42Z",
    "source_sha256": "c7aa8c79db6dadcd32d0ac3a436003d90a673f4aff34c2515d937a0cf441fa88",
    "trait_tree_id": 658
  },
  "spec": {
    "slug": "frost-mage",
    "class_id": 8,
    "spec_id": 64,
    "class_name": "Mage",
    "spec_name": "Frost"
  },
  "budgets": {
    "class": 47,
    "spec": 43,
    "hero": 13
  },
  "full_node_order": [
    62084,
    62085,
    62086,
    62087,
    62088,
    62091,
    62092,
    62094,
    62096,
    62098,
    62100,
    62102,
    62104,
    62105,
    62107,
    62110,
    62112,
    62114,
    62115,
    62116,
    62117,
    62119,
    62121,
    62122,
    62123,
    62124,
    62125,
    62127,
    62129,
    62150,
    62151,
    62153,
    62157,
    62163,
    62164,
    62170,
    62173,
    62174,
    62176,
    62177,
    62178,
    62179,
    62180,
    62181,
    62182,
    62184,
    62185,
    81468,
    93524,
    94632,
    94633,
    94634,
    94635,
    94636,
    94637,
    94638,
    94639,
    94640,
    94641,
    94642,
    94643,
    94644,
    94645,
    94646,
    94647,
    94648,
    94649,
    94650,
    94651,
    94652,
    94653,
    94654,
    94655,
    94656,
    94657,
    94658,
    94659,
    94660,
    94661,
    94662,
    94663,
    94664,
    99828,
    99829,
    99830,
    100989,
    100995,
    100998,
    100999,
    101004,
    101007,
    101009,
    101015,
    101016,
    101019,
    101021,
    101024,
    101027,
    101029,
    101883,
    102438,
    102439,
    102440,
    102441,
    102445,
    102446,
    102449,
    102451,
    102453,
    102454,
    102460,
    102462,
    102465,
    102467,
    102468,
    102469,
    102470,
    102471,
    102472,
    102474,
    102475,
    102476,
    102480,
    103771,
    104113,
    108535,
    108536,
    108537,
    108538,
    108539,
    108541,
    108551,
    108653,
    108654,
    108655,
    108656,
    108657,
    108658,
    108659,
    108660,
    108661,
    108662,
    108664,
    108665,
    108849,
    108850,
    108851,
    108852,
    108853,
    108855,
    108857,
    108858,
    108859,
    108860,
    108863,
    108864,
    109002,
    109393,
    109394,
    109395,
    109396,
    109397,
    109398,
    109399,
    109400,
    109401,
    109402,
    109403,
    109404,
    109406,
    109407,
    109408,
    109409,
    109411,
    109412,
    109478,
    109667,
    109668,
    109669,
    109670,
    109671,
    109672,
    109673,
    109674,
    109675,
    109915,
    109916,
    109956,
    110078,
    110079,
    110080,
    110081,
    110082,
    110086,
    110087,
    110088,
    110089,
    110258,
    110283,
    110321,
    110322,
    110420,
    110422,
    110423,
    110442,
    110597,
    110849,
    110850
  ],
  "trees": {
    "class": {
      "nodes": [
        {
          "id": 62117,
          "name": "Ice Barrier",
          "type": "single",
          "x": 3900,
          "y": 1500,
          "col": 3,
          "row": 0,
          "max_ranks": 1,
          "req_points": null,
          "entry_node": true,
          "is_apex": false,
          "free": true,
          "prev": [],
          "next": [
            62115,
            62122
          ],
          "entries": [
            {
              "id": 80176,
              "spell_id": 11426,
              "name": "Ice Barrier",
              "icon": "spell_ice_lament",
              "type": "active",
              "max_ranks": 1,
              "description": "Ice BarrierTalent3% of base manaInstant30 sec cooldown1 ChargeRequires MageShields you with ice, absorbing [35 / 100 * Total Health * (1 + Versatility)] damage [Glacial Insulation: and increasing your armor by 0%] for 1 min.\n\nMelee attacks against you reduce the attacker's movement speed by 50%."
            }
          ]
        },
        {
          "id": 62115,
          "name": "Alter Time",
          "type": "single",
          "x": 3300,
          "y": 2100,
          "col": 2,
          "row": 1,
          "max_ranks": 1,
          "req_points": null,
          "entry_node": false,
          "is_apex": false,
          "free": false,
          "prev": [
            62117
          ],
          "next": [
            108654,
            62102
          ],
          "entries": [
            {
              "id": 80174,
              "spell_id": 342245,
              "name": "Alter Time",
              "icon": "spell_mage_altertime",
              "type": "active",
              "max_ranks": 1,
              "description": "Alter TimeTalent1% of base manaInstant1 min cooldownRequires MageAlters the fabric of time, returning you to your current location and health when cast a second time, or after 10 sec. Effect negated by long distance or death."
            }
          ]
        },
        {
          "id": 62122,
          "name": "Ice Block",
          "type": "single",
          "x": 4500,
          "y": 2100,
          "col": 4,
          "row": 1,
          "max_ranks": 1,
          "req_points": null,
          "entry_node": false,
          "is_apex": false,
          "free": false,
          "prev": [
            62117
          ],
          "next": [
            62123,
            62107
          ],
          "entries": [
            {
              "id": 80181,
              "spell_id": 45438,
              "name": "Ice Block",
              "icon": "spell_frost_frost",
              "type": "active",
              "max_ranks": 1,
              "description": "Ice BlockTalentInstant4 min cooldown1 ChargeRequires MageEncases you in a block of ice, protecting you from all attacks and damage for 10 sec, but during that time you cannot attack, move, or cast spells.\n\nCauses Hypothermia, preventing you from recasting Ice Block for 30 sec."
            }
          ]
        },
        {
          "id": 108654,
          "name": "Time Walk / Temporal Realignment",
          "type": "choice",
          "x": 2700,
          "y": 2700,
          "col": 1,
          "row": 2,
          "max_ranks": 1,
          "req_points": null,
          "entry_node": false,
          "is_apex": false,
          "free": false,
          "prev": [
            62115
          ],
          "next": [
            62114
          ],
          "entries": [
            {
              "id": 134183,
              "spell_id": 1244087,
              "name": "Time Walk",
              "icon": "warrior_doubletime",
              "type": "passive",
              "max_ranks": 1,
              "description": "Time WalkTalentRequires MageAlter Time resets the cooldown of Blink and Shimmer when you return to your original location."
            },
            {
              "id": 134182,
              "spell_id": 1244090,
              "name": "Temporal Realignment",
              "icon": "ability_evoker_timedilation",
              "type": "passive",
              "max_ranks": 1,
              "description": "Temporal RealignmentTalentRequires MageUpon dropping below 25% health, your past self corrects your timeline, casting Alter Time and instantly returning 20% of your maximum health and healing you for an additional 30% over 6 sec."
            }
          ]
        },
        {
          "id": 62102,
          "name": "Master of Time",
          "type": "single",
          "x": 3300,
          "y": 2700,
          "col": 2,
          "row": 2,
          "max_ranks": 2,
          "req_points": null,
          "entry_node": false,
          "is_apex": false,
          "free": false,
          "prev": [
            62115
          ],
          "next": [
            62114,
            108660
          ],
          "entries": [
            {
              "id": 80159,
              "spell_id": 342249,
              "name": "Master of Time",
              "icon": "inv_belt_armor_waistoftime_d_01",
              "type": "passive",
              "max_ranks": 2,
              "description": "Master of TimeTalentRequires MageRequires level 25\nReduces the cooldown of Alter Time by 5 sec."
            }
          ]
        },
        {
          "id": 62123,
          "name": "Winter's Protection",
          "type": "single",
          "x": 4500,
          "y": 2700,
          "col": 4,
          "row": 2,
          "max_ranks": 2,
          "req_points": null,
          "entry_node": false,
          "is_apex": false,
          "free": false,
          "prev": [
            62122
          ],
          "next": [
            108660,
            62124
          ],
          "entries": [
            {
              "id": 80182,
              "spell_id": 382424,
              "name": "Winter's Protection",
              "icon": "spell_ice_rune",
              "type": "passive",
              "max_ranks": 2,
              "description": "Winter's ProtectionTalentRequires MageThe cooldown of Ice Block is reduced by 30 sec."
            }
          ]
        },
        {
          "id": 62107,
          "name": "Frost Conditioning",
          "type": "single",
          "x": 5100,
          "y": 2700,
          "col": 5,
          "row": 2,
          "max_ranks": 1,
          "req_points": null,
          "entry_node": false,
          "is_apex": false,
          "free": false,
          "prev": [
            62122
          ],
          "next": [
            62124
          ],
          "entries": [
            {
              "id": 80165,
              "spell_id": 1250315,
              "name": "Frost Conditioning",
              "icon": "spell_frost_icefloes",
              "type": "passive",
              "max_ranks": 1,
              "description": "Frost ConditioningTalentRequires MageHypothermia's duration is reduced by 10 sec."
            }
          ]
        },
        {
          "id": 62114,
          "name": "Arcane Warding",
          "type": "single",
          "x": 2700,
          "y": 3300,
          "col": 1,